tweet_id	begin	end	type	umls_id	extraction	drug	tweet	other	meddra_code	meddra_LLTerm
347326324085510144	86	88	INDICATION	c0009324	UC	humira	your humira shot burns with the power of a thousand suns #ibdfmlmoments #crohns #ibd #uc	2	10045365	ulcerative colitis									
347326633725800448	89	94	ADR	c0151828	hurts	humira	"today is the day for my biweekly humira injection, any volunteers to take it for me?  it hurts."	1	10022086	injection site pain									
347360872278151168	8	17	INDICATION	c0013415	dysthymia	seroquel	new dx: dysthymia. start seroquel (which i've had before. it zombified me iirc).	2	10013981	dysthymia									
347360872278151168	61	70	ADR	c0857486	zombified	seroquel	new dx: dysthymia. start seroquel (which i've had before. it zombified me iirc).	1	10016384	felt like a zombie									
347368413880016897	36	41	INDICATION	c0917801	sleep	trazodone	@glass1ncision for sure. i'd get no sleep at all if it wasn't for #trazodone. :)	2	10041017	sleeplessness									
347414282138431488	77	88	ADR	c0043094	weight gain	zyprexa	"@anyssiakaissa depakote made me feel flat, but helps many. zyprexa can cause weight gain, so be very careful. i can't tolerate it."	1	10047896	weight gain									
347414282138431488	15	23	DRUG	c1363193	Depakote	zyprexa	"@anyssiakaissa depakote made me feel flat, but helps many. zyprexa can cause weight gain, so be very careful. i can't tolerate it."	2											
347529563628253184	52	68	ADR	c0234458	messed up dreams	seroquel	takin anbien &amp;seroquel for bad insomnia gives u messed up dreams doc saids its normal	1	10004969	bizarre dreams									
347529563628253184	35	43	INDICATION	c0917801	insomnia	seroquel	takin anbien &amp;seroquel for bad insomnia gives u messed up dreams doc saids its normal	2	10022437	insomnia									
347552147954622464	83	95	ADR	c1868917	racing heart	humira	been on humira now short period 4 to 6 injections no noticeable change in pain but racing heart and palpitations. mtx at 1ml injection.	1	10019303	heart rate increased									
347552147954622464	74	78	INDICATION	c0030193	pain	humira	been on humira now short period 4 to 6 injections no noticeable change in pain but racing heart and palpitations. mtx at 1ml injection.	2	10033371	pain									
347552147954622464	100	112	ADR	c0030252	palpitations	humira	been on humira now short period 4 to 6 injections no noticeable change in pain but racing heart and palpitations. mtx at 1ml injection.	1	10033557	palpitations									
347620121323372545	46	56	DRUG	null	citalopram	effexor	"@elladeruiter oh i hate that! i used to be on citalopram, it stopped working eventually. sometimes i have to up my effexor dose temporarily."	2											
347639316425617408	19	29	INDICATION	c0020040	hotflashes	effexor	hey not sleeping. #hotflashes #menopause #effexor	2	10020407	hot flashes									
347639316425617408	4	16	ADR	c0917801	not sleeping	effexor	hey not sleeping. #hotflashes #menopause #effexor	1	10041017	sleeplessness									
347639316425617408	31	40	INDICATION	c0025320	menopause	effexor	hey not sleeping. #hotflashes #menopause #effexor	2	10027308	menopause 									
347755633300361216	72	78	INDICATION	c0010346	crohns	humira	self-injected humira for first time! fingers x'd it works #spondylitis #crohns	2	10011401	Crohn's Disease									
347755633300361216	59	70	INDICATION	c0038012	spondylitis	humira	self-injected humira for first time! fingers x'd it works #spondylitis #crohns	2	10061371	spondylitis									
347771700370370560	84	100	Indication	c0011570	anti-depressants	viibryd	"@kniterrupted i think it’s an snri, i’m not even sure. it’s viibryd. but none of my anti-depressants have ever messed me up like this before"	2	10012378	depression									
347771700370370560	111	123	ADR	c0231218	messed me up	viibryd	"@kniterrupted i think it’s an snri, i’m not even sure. it’s viibryd. but none of my anti-depressants have ever messed me up like this before"	1	10016370	feeling unwell									
347784229842726913	47	52	ADR	c0234238	aches	rivaroxaban	19.32 day 20 rivaroxaban diary. still residual aches and pains; only had 4 paracetamol today.	1	10000424	ache									
347784229842726913	57	62	ADR	c0030193	pains	rivaroxaban	19.32 day 20 rivaroxaban diary. still residual aches and pains; only had 4 paracetamol today.	1	10033371	pain									
347788913479393280	49	68	ADR	c0152128	feel kinda terrible	effexor	i better go to bed.. effexor withdrawal makes me feel kinda terrible ugh.	1	10016370	feeling unwell									
347788913479393280	29	39	ADR	c0152128	withdrawal	effexor	i better go to bed.. effexor withdrawal makes me feel kinda terrible ugh.	1	10048010	withdrawal syndrome									
347811246160113665	113	120	INDICATION	c0581932	relapse	tysabri	so i finally have my 1st infusion of #tysabri set for nxt fri. so i'm supposed to suffer until it kicks in? this relapse is relentless. ??	2	10048393	multiple sclerosis relapse									
347813901771096065	42	44	INDICATION	c0010674	Cf	cipro	@mrs_lgardner just got him from seeing my cf dr. no collapse or pneumonia. start of a flare up probably so 2 weeks of oral cipro......	2	10011762	cystic fibrosis									
347813901771096065	86	94	INDICATION	c0581392	flare up	cipro	@mrs_lgardner just got him from seeing my cf dr. no collapse or pneumonia. start of a flare up probably so 2 weeks of oral cipro......	2	10007636	condition worsened									
347824349572644865	39	51	ADR	c0043094	gained 40lbs	quetiapine	@missynomatter i was on quetiapine and gained 40lbs &lt;wall&gt; so i am not even trying olanzapine. they gave me abilify cause it not supposed to	1	10047896	weight gain									
347824349572644865	24	34	DRUG	c0123091	quetiapine	olanzapine	@missynomatter i was on quetiapine and gained 40lbs &lt;wall&gt; so i am not even trying olanzapine. they gave me abilify cause it not supposed to	2											
347834378270961664		130	ADR		inside i was still screaming	fluoxetine	"@sewyoursoul i 'served' 6months of fluoxetine-time around 18 years ago, it put a smile on my face but inside i was still screaming. :("	1	10014554	emotional instability									
347901325801029632	98	118	ADR	c0948265	metabolic syndrome	seroquel	"@privacy625 @sandycolon25 what i take is serious. i never was informed ahead of time. i could get ""metabolic"" syndrome from seroquel."	1	10052066	metabolic syndrome									
347934179578765312	82	87	INDICATION	c0917801	sleep	seroquel	i'm bout to get me a sierra mist.  i wish i had some seroquel xr so i could go to sleep	2	10041011	sleep problem									
347973045023043584	17	30	ADR	c0917799	knocks me out	seroquel	half of seroquel knocks me out so fast and im asleep for at least 10 hours...	1	10041349	somnolence									
347986748795650048	100	115	ADR	c0268000	fluid retention	rivaroxaban	08.55 day 21 rivaroxaban diary strange muscle spasms especially in neck shoulders and legs. no more fluid retention. more mobile.	1	10016807	fluid retention									
347986748795650048	122	128	ADR	c0700572	mobile	rivaroxaban	08.55 day 21 rivaroxaban diary strange muscle spasms especially in neck shoulders and legs. no more fluid retention. more mobile.	1	10021417	immobile									
347986748795650048	39	52	ADR	c0037763	muscle spasms	rivaroxaban	08.55 day 21 rivaroxaban diary strange muscle spasms especially in neck shoulders and legs. no more fluid retention. more mobile.	1	10028333	muscle spasm									
348136954900127744	1	9	Indication	c0014544	epilepsy	lamotrigine	#epilepsy is sucktastic. neuro appt monday to discuss a third med after getting the rash with lamotrigine and the glaucoma with topiramate.	2	10015037	epilepsy									
348136954900127744	84	88	ADR	c0015230	Rash	lamotrigine	#epilepsy is sucktastic. neuro appt monday to discuss a third med after getting the rash with lamotrigine and the glaucoma with topiramate.	1	10037844	rash									
348136954900127744	114	122	ADR	c0017601	Glaucoma	topiramate	#epilepsy is sucktastic. neuro appt monday to discuss a third med after getting the rash with lamotrigine and the glaucoma with topiramate.	1	10018304	Glaucoma									
348136954900127744	128	138	DRUG	c0076829	topiramate	lamotrigine	#epilepsy is sucktastic. neuro appt monday to discuss a third med after getting the rash with lamotrigine and the glaucoma with topiramate.	2											
348218989199118336	33	51	ADR	c0030554	pins &amp; needles	humira	@thestomabaglady i still get the pins &amp; needles feeling in my hands since doing humira	1	10035067	pins and needles									
348272601430364160	119		ADR	c0277656	shot my daughter	effexor	"@realhausfrau @tantalizinyou my step-dad was on effexer,taking supplements for energy and drinking like a fish when he shot my daughter&amp;me"	1	10064160	homicidal attempt									
348283506037764098	69	91	ADR	c0424230	thirty minutes to type	seroquel	this seroquel got me lo0o0py as helll.  this status took me at least thirty minutes to type i keep waking up without knowing i feel asleep	1	10010300	confusion									
348283506037764098	21	28	ADR	c0541992	lo0o0py	seroquel	this seroquel got me lo0o0py as helll.  this status took me at least thirty minutes to type i keep waking up without knowing i feel asleep	1	10017565	fuzzy									
348283506037764098	99	138	ADR	c0694563	waking up without knowing I feel asleep	seroquel	this seroquel got me lo0o0py as helll.  this status took me at least thirty minutes to type i keep waking up without knowing i feel asleep	1	10041349	somnolence									
348287743568277504	104	119	ADR	c0268000	fluid retention	rivaroxaban	rivaroxaban diary day 22. am beginning to think all pains from pressure on that part of body are due to fluid retention.	1	10016807	fluid retention									
348287743568277504	52	57	ADR	c0030193	pains	rivaroxaban	rivaroxaban diary day 22. am beginning to think all pains from pressure on that part of body are due to fluid retention.	1	10033371	pain									
348311468749504512	56	67	INDICATION	c0917801	fall asleep	seroquel	i took my seroquel over an hour ago hoping it'd make me fall asleep but i'm still up	2	10041017	sleeplessness									
348355774642266112	91	99	INDICATION	c0917801	insomnia	seroquel	"@_katball natural don't work for me, try 300mg of seroquel...you'll sleep for days, i have insomnia that's what they give me lol"	2	10022437	insomnia									
348355774642266112	68	82	ADR	c0917799	sleep for days	seroquel	"@_katball natural don't work for me, try 300mg of seroquel...you'll sleep for days, i have insomnia that's what they give me lol"	1	10041349	somnolence									
348387894416773120	37	46	ADR	c0085281	addictive	alprazolam	doc for panic disorders: alprazolam (addictive) and paroxetine (sedating). #psychiatry	1	10001125	addiction									
348387894416773120	8	23	INDICATION	c0030319	Panic disorders	paroxetine	doc for panic disorders: alprazolam (addictive) and paroxetine (sedating). #psychiatry	2	10033666	panic disorder									
348387894416773120	64	72	ADR	c0235194	sedating	paroxetine	doc for panic disorders: alprazolam (addictive) and paroxetine (sedating). #psychiatry	1	10039897	sedation									
348387894416773120	25	35	Drug	null	alprazolam	alprazolam	doc for panic disorders: alprazolam (addictive) and paroxetine (sedating). #psychiatry	2											
348456216663580673	27	37	ADR	c0392674	physically	paxil	@criminalbanjo dude i feel physically and mentally drained.. thats the paxil i wanted hard at work	1	10015667	exhaustion									
348456216663580673	42	58	ADR	c0085628	mentally drained	paxil	@criminalbanjo dude i feel physically and mentally drained.. thats the paxil i wanted hard at work	1	10076757	mental fatigue									
348514777183690752	51	57	INDICATION	c0011860	type 2	victoza	"@rgay given what we know about the demographics of type 2, i'm a bit surprised she's still all over the victoza page."	2	10045242	type 2 diabetes									
348550250304258048	22	37	Indication	c0011860	Type 2 diabetes	victoza	she announced she had type 2 diabetes on the day she endorsed the diabetes drug victoza and a lucrative collaboration with the  manufacturer	2	10045242	type 2 diabetes									
348570535342530561	117	127	INDICATION	c0025289	meningitis	cipro	someone back me up to @mrdispenser about what a trauma when you have to dispense 20 lots of rifampicin and cipro for meningitis prophylaxis	2	10027199	meningitis									
348570535342530561	128	139	INDICATION	c0282638	prophylaxis	cipro	someone back me up to @mrdispenser about what a trauma when you have to dispense 20 lots of rifampicin and cipro for meningitis prophylaxis	2	10036898	prophylatic									
348595096352075776	92	98	INDICATION	c0027497	nausea	zyprexa	@incubator04 i'm hoping that i get on the zyprexa. the gi was pretty sure it would help the nausea and i know it'll help the crazies.	2	10028813	nausea									
348595096352075776	125	132	INDICATION	c0033975	crazies	zyprexa	@incubator04 i'm hoping that i get on the zyprexa. the gi was pretty sure it would help the nausea and i know it'll help the crazies.	2	10037234	psychosis									
348649853552828417	72	96	ADR	c0004604	"back, hip, and leg aches"	rivaroxaban	"04.46 day 23 rivaroxaban diary. much better than yesterday. still neck, back, hip, and leg aches but not so intense."	1	10003978	back ache									
348649853552828417	87	96	ADR	c0023222	leg aches	rivaroxaban	"04.46 day 23 rivaroxaban diary. much better than yesterday. still neck, back, hip, and leg aches but not so intense."	1	10024130	leg pain									
348649853552828417	66	96	ADR	c0007859	"neck, back, hip, and leg aches"	rivaroxaban	"04.46 day 23 rivaroxaban diary. much better than yesterday. still neck, back, hip, and leg aches but not so intense."	1	10028836	neck pain									
348649853552828417	78	96	ADR	c0019559	"hip, and leg aches"	rivaroxaban	"04.46 day 23 rivaroxaban diary. much better than yesterday. still neck, back, hip, and leg aches but not so intense."	1	10033432	pain in hip									
348662789964972032	69	79	ADR	c0018681	headaches 	effexor	"@silkwould smh. lmao paxil was my first, i just stopped effexor (the headaches were a nightmare)"	1	10019211	headache									
348662789964972032	56	63	DRUG	c0078569	effexor	paxil	"@silkwould smh. lmao paxil was my first, i just stopped effexor (the headaches were a nightmare)"	2											
348671976308609024	79	114	ADR	c1456784	common for apartments to be haunted	paxil	the toilet just flushed itself.  my apartment is haunted.  paxil tells me it's common for apartments to be haunted.  send help	1	10022989	irrational									
348695929227993088	109	123	ADR	c0040615	antipsychotics	trazodone	"@wickleperson i do have a crisis number, but i'm just going to knock myself out today w/ trazodone and start antipsychotics today too."	0	10037234	psychosis									
348695929227993088	109	123	Indication	c0033975	antipsychotics	trazodone	"@wickleperson i do have a crisis number, but i'm just going to knock myself out today w/ trazodone and start antipsychotics today too."	2	10037234	psychosis									
348697959086583808	92	105	INDICATION	c0040615	antipschotucs	trazodone	@furyofpatience @fullcommujism try dexter. going to knock myself out w/ trazodone and start antipschotucs today. fortune'y they work quickly	2	10037234	psychosis									
348748124916965377	120	127	INDICATION	c0003467	anxiety	paroxetine	wish it was monday...seeing doctor tomorrow &amp; want to see if he has any suggestions for my withdrawal. #paroxetine #anxiety #fedup	2	10002855	anxiety									
348748124916965377	95	105	ADR	c0152128	withdrawal	paroxetine	wish it was monday...seeing doctor tomorrow &amp; want to see if he has any suggestions for my withdrawal. #paroxetine #anxiety #fedup	1	10048010	withdrawal syndrome									
348807944244166658	33	38	ADR	c0030193	Pains	rivaroxaban	15.15 rivaroxaban diary day 24.  pains easing all the time. didn't take losartan yesterday. will get bp and hopefully inr checked today.	1	10033371	pain									
348813268363657216	0	42	ADR	c0917799	Feels like one of those 5-cup #coffee days	seroquel	feels like one of those 5-cup #coffee days - but wait: i'm weaning off #seroquel. aha!	1	10015595	excessive daytime sleepiness									
348829559958937601	106	119	ADR	c0043094	stay in shape	seroquel	"the most upsetting thing about silver linings playbook, is how bradley cooper can take seroquel and still stay in shape."	1	0051602	laziness									
348846174846992384	70	73	ADR	c0221423	ill	viibryd	then the viibryd it will be the hardest. makes you very ill. hospital ill.	1	10021345	ill feeling									
348854533025304576	98	120	INDICATION	c1657467	relaxes ur vocal cords	lozenge	"@codysimpson drink herbal tea, hot lemon water or take a ""voice lozenge"" (it clears ur throat and relaxes ur vocal cords, i use them myself)"	2	10078796	vocal cord spasm									
348854533025304576	87	93	INDICATION	c0242429	throat	lozenge	"@codysimpson drink herbal tea, hot lemon water or take a ""voice lozenge"" (it clears ur throat and relaxes ur vocal cords, i use them myself)"	2	10059004	productive cough									
348894274470948864	129	134	INDICATION	c0003873	rheum	enbrel	"did one shot of enbrel, but chose the infusion rather than self injection.  don't know what he has in mind. hoping for success. #rheum"	2	10039073	rheumatoid arthritis									
348898370867302400	37	51	INDICATION	c0011570	antidepressant	paxil	"*the fifth bottle paxil...her notes ""antidepressant, good daily medication, especially going out in public"" she take one immediately.*"	2	10012378	depression									
348898590124552193	25	33	ADR	c0234458	lucidity	effexor	"effexor dreams, now with lucidity. i grant the power of flight?"	1	10079069	lucid dreams									
348899385310064640	70	73	INDICATION	c0005586	bpd	quetiapine	@girl_interrupt_ yes totally. psych prescribed me quetiapine to help #bpdchat	2	10057667	bipolar disorder									
348901778563166209	12	33	ADR	c0344320	dreams became vivider	effexor	@mcmorag my dreams became vivider i think with effexor #bpdchat	1	10047666	vivid dreams									
348901778563166209	56	59	INDICATION	c0005586	BPD	effexor	@mcmorag my dreams became vivider i think with effexor #bpdchat	2	10057667	bipolar disorder									
348906168556605440	89	107	ADR	c0917799	sleep all the time	olanzapine	bombed on olanzapine. work going to be tricky. 5 days of not drinking coming up. i could sleep all the time atm.	1	10041349	somnolence									
348906168556605440	0	6	ADR	c0235194	Bombed	olanzapine	bombed on olanzapine. work going to be tricky. 5 days of not drinking coming up. i could sleep all the time atm.	1	10070679	feeling stoned									
348907867593658368	95	100	INDICATION	c0003873	rheum	humira	@dsymons @trainingwithra i agree that the after sting is much worse from #humira than #enbrel #rheum	2	10039073	rheumatoid arthritis									
348907867593658368	42	53	ADR	c0677500	after sting	humira	@dsymons @trainingwithra i agree that the after sting is much worse from #humira than #enbrel #rheum	1	10058683	injection site stinging									
348907867593658368	87	93	Drug	null	enbrel	humira	@dsymons @trainingwithra i agree that the after sting is much worse from #humira than #enbrel #rheum	2											
348907962372349952	80	84	ADR	c0015230	rash	lamictal	@cheer_bear13 @lithiumlibgirl i couldn't take lamictal 1 week into it i got the rash.a rush trip to the er.6 months till rash was gone.	1	10037844	rash									
348940056553197568	62	94	ADR	c0011124	look at my Farrah Fawcett poster	paxil	i didn't expect that going off of paxil would make me want to look at my farrah fawcett poster quite so much.	1	10024870	loss of libido									
349022614959837184	60	70	ADR	c0152128	withdrawal	effexor	panic attacking because you cant find your effexor and know withdrawal will set in momentarily  &lt;&lt;&lt;&lt;&lt;&lt;&lt;.	1	10048010	withdrawal syndrome									
349033495026343936	69	73	ADR	c0231218	sick	venlafaxine	"@warwraith i'm not even sure what to request. :/ sertraline makes me sick now, venlafaxine made me sick, reboxetine and citalopram useless"	1	10016365	feeling sick									
349060806245240832	15	21	INDICATION	c0010346	crohns	humira	question time #crohns #ibd #humira does anyone suffer from egg burps? what works for you	2	10011401	Crohn's Disease									
349060806245240832	23	26	INDICATION	c0021390	ibd	humira	question time #crohns #ibd #humira does anyone suffer from egg burps? what works for you	2	10021184	IBD									
349060806245240832	59	68	ADR	c0014724	egg burps	humira	question time #crohns #ibd #humira does anyone suffer from egg burps? what works for you	1	10063053	malodoerous burping									
349079028818395136	30	35	INDICATION	c0917801	sleep	seroquel	im out of seroquel how will i sleep it's a mystery	2	10041017	sleeplessness									
349181810237898752	95	113	ADR	c0043094	increase my weight	zyprexa	"i'm so fine today. increasing zyprexa,my condisition became so good. it has a side effect that increase my weight. i must care about it."	1	10047896	weight gain									
349184456558518272		66	ADR	c0034634	rage breaking things	seroquel	"@oscli every time i forget seroquel, i end up rage breaking things eg- my laptop *facepalm*"	1	10037804	rage									
349189973662134272	60	67	INDICATION	c0003467	anxiety	paxil	being sick every morning is getting really old. not sure if anxiety or my body getting used to paxil.  anyone know?	2	10002855	anxiety									
349189973662134272	6	10	ADR	c0231218	sick	paxil	being sick every morning is getting really old. not sure if anxiety or my body getting used to paxil.  anyone know?	1	10016365	feeling sick									
349190696961466368	91	105	ADR	c0231218	kicking my ass	humira	i can't wait to go get my anti nauaea meds tonight. i feel like shit. humira is definitely kicking my ass but my skin lools great.	1	10016370	feeling unwell									
349190696961466368	31	37	ADR	c0027497	nauaea	humira	i can't wait to go get my anti nauaea meds tonight. i feel like shit. humira is definitely kicking my ass but my skin lools great.	1	10028813	nausea									
349190696961466368	113	117	INDICATION	c0033860	skin	humira	i can't wait to go get my anti nauaea meds tonight. i feel like shit. humira is definitely kicking my ass but my skin lools great.	2	10037153	psoriasis									
349205685835272193	72	101	ADR	c0239377	arms just keep getting worse.	cipro	rt @annie_monster: wtf? can't even get whipped cream out of the can? my arms just keep getting worse. damned cipro.	1	10033421	pain in arm									
349205685835272193	24	67	ADR	c0151786	can't even get whipped cream out of the can	cipro	rt @annie_monster: wtf? can't even get whipped cream out of the can? my arms just keep getting worse. damned cipro.	1	10047862	weakness									
349217065019777024	101	115	INDICATION	c0085633	mood is stable	paxil	"i think i might have to try something else than paxil. though, i do enjoy it with abilify so that my mood is stable, just does nothing for"	2	10027951	mood swings									
349294117076996096	41	50	INDICATION	c0235876	depressed	lamictal	@k_mowers i think very tired; maybe more depressed. i don't know. you know i stopped taking the lamictal a few days ago....	2	10012378	depression									
349328587255590912	84	94	ADR	c0038587	withdrawal	seroquel	@tootingrebecca it helped me enormously with seroquel withdrawal but it makes benzo withdrawal much worse.	1	10048010	withdrawal syndrome									
349382072810483712	109	120	ADR	c0231218	feel so Ick	quetiapine	whoah so dizzing.  damn   tamazapam - shld probably wap back to quetiapine if this keeps up! but it makes me feel so ick!	1	10016370	feeling unwell									
349382072810483712	26	35	DRUG	null	Tamazapam	quetiapine	whoah so dizzing.  damn   tamazapam - shld probably wap back to quetiapine if this keeps up! but it makes me feel so ick!	2											
349417228166373378	12	15	INDICATION	c0028768	OCD	lamictal	fighting an ocd spike tonight; makes me worried about trading the lexapro in for lamictal. i don't do well without support for the ocd.	2	10029898	obsessive-compulsive disorder									
349447249161494530	36	58	ADR	c0235198	doing things difficult	seroquel	"the seroquel the doc gave me, makes doing things difficult. . . but if i don't do something, i'll fall asleep. the catch-22 of crazy."	1	10027348	mental concentration difficult									
349447249161494530	127	132	INDICATION	c0033975	crazy	seroquel	"the seroquel the doc gave me, makes doing things difficult. . . but if i don't do something, i'll fall asleep. the catch-22 of crazy."	2	10037234	psychosis									
349447249161494530	98	109	ADR	c0917799	fall asleep	seroquel	"the seroquel the doc gave me, makes doing things difficult. . . but if i don't do something, i'll fall asleep. the catch-22 of crazy."	1	10041349	somnolence									
349455785308327936	93	102	ADR	c0234238	body ache	humira	@jennyelliott88 ffs!! i'm getting shooting pains down arms &amp; legs now &amp; in eve whole body ache #humira is horrible ??	1	10000424	ache									
349455785308327936	34	58	ADR	c0239377	shooting pains down arms	humira	@jennyelliott88 ffs!! i'm getting shooting pains down arms &amp; legs now &amp; in eve whole body ache #humira is horrible ??	1	10050007	shooting pain									
349455785308327936		69	ADR	c0023222	shooting pains down arms &amp; legs	humira	@jennyelliott88 ffs!! i'm getting shooting pains down arms &amp; legs now &amp; in eve whole body ache #humira is horrible ??	1	10050007	shooting pain									
349468860673572864	68	79	ADR	c0522172	lightweight	paxil	screw you paxil! you do wonders for anxiety but you make me a ultra lightweight	1	10001598	alcohol intolerance									
349468860673572864	36	43	INDICATION	c0003467	anxiety	paxil	screw you paxil! you do wonders for anxiety but you make me a ultra lightweight	2	10002855	anxiety									
349477008398491649	107	112	INDICATION	c0917801	sleep	trazodone	"hi, my name's makenna and my mom wanted to give me melatonin instead of my trazodone and i haven't gone to sleep yet.. fml."	2	10041017	sleeplessness									
